,Unnamed: 0,Unnamed: 0.1,Unnamed: 0.1.1,article_filepath,article_name,count,date,dir,energy_type,index_article,index_metadata,metadata_filepath,metadata_title,newspaper_city,newspaper_date,newspaper_issuenumber,newspaper_language,newspaper_publisher,newspaper_source,newspaper_title,newspaper_volume,accuracy_selection,text,text_clean,type,sentiment,energy
595,35,802,802,/Users/leonardovida/dev/HistAware/data/raw/delpher/1980s/1984/04-25/DDD_010378597/DDD_010378597_0128_articletext.xml,DDD_010378597_0128_articletext.xml,3,1984-04-25,/Users/leonardovida/dev/HistAware/data/raw/delpher/1980s/1984/04-25/DDD_010378597,coal,7429537,24279.0,/Users/leonardovida/dev/HistAware/data/raw/delpher/1980s/1984/04-25/DDD_010378597/DDD:ddd:010378597:mpeg21.didl.xml.gz.xml,DDD:ddd:010378597:mpeg21.didl.xml.gz.xml,Amsterdam,1984-04-25,129.0,nl,s.n.,KB C 157,De waarheid,44.0,0.0497123062529958,"Door onze medewerker in Engelam Lolke van der Heide De voorzitter van de Engels' Coalboard McGregor heeft aange boden de afslanking van de Engelt se mijnen over een langere periodj uit te smeren. In eerste instantii lag het in de bedoeling om binnei^ twaalf maanden 20.000 mijnwer, kers af te laten vloeien en viej< miljoen ton kolen minder te gaaif, produceren. De aankondiging var^ McGregor wordt door sommige^ gezien als een concessie aan dt.-mijnwerkers die voor het grootst* deel al wekenlang in staking zijn. R Arthur Scargill, de voorzitter van dG mijnwerkersbond, echter reageerde furieus op McGregors voorstellen. Hr zei dat zijn bond, de NUM die verre-, weg het grootste deel van de mijnwerj kers organiseert, niet geïnteresseerd is,. in een program van afslankingen^ maar alleen met de Coalboard wir praten over „een zich uitbreidend* industrietak"". De kolenindustrie heef^ in de ogen van Scargill een goedG toekomst nu andere energiebronnen; steeds onzekerder worden. e Scargills vakbondsleden staan iif overgrote meerderheid achter de vak-j' bondsstrategie van de afgelopeiv maanden. Vlak voor Pasen werd o{T een NUM-meeting in Sheffield eerL nationale stemming over de staking^ verworpen en een oproep voor cciv algemene landelijke staking aangeno-t men. Of daaraan gehoor gegeven zal worden is nog maar de vraag. In Nottinghamshire ligt het knelpunt De meeste van de vijfentwintig mijnere in dit gebied hebben tot nu toe ge-> werkt tijdens de stakingsperiode. Bit de zes mijnen die dinsdagochtend volgens schema weer moesten gaarf werken na de paasvakantie passeerdetr mijnwerkers ondanks de stakingso-i proep uit Sheffield de posters om gewoon aan het werk te gaan. Morgen zouden de andere mijnen in het gebied weer aan het werk moeten gaan. Tussen mijnwerkers en arbeiders irc de staalindustrie blijven conflicten bestaan. De stakers willen geen kolenleveren aan de hoogovens. Hierin wor-j den ze gesteund door""havenarbeiders die weigeren schepen met buitenlandse kolen te lossen. De metaalarbeiderSi zijn bang dat de staking sluiting van, hun fabrieken zou kunnen inhouden, j Bij het Schotse metaalcomplex Rafenscrake is de situatie het nijpendst"" De Schotse NUM-leider Mick MacHay beseft terdege dat sluiting van Rafens-j crake een ernstige aantasting van d«j Schotse economie zou zijn. De NUM stelt zich in dit geval dan ook terugJ houdend op.",door onze medewerker in van der heide de voorzitter van de heeft boden de afslanking van de se mijnen over een langere te smeren in eerste lag het in de bedoeling om twaalf maanden kers af te laten vloeien en miljoen ton kolen minder te de aankondiging wordt door gezien als een concessie aan die voor het grootst deel al wekenlang in staking zijn de voorzitter van echter reageerde op voorstellen zei dat zijn bond de die weg het grootste deel van de kers organiseert niet ge is in een program van maar alleen met de praten over een zich de in de ogen van een toekomst andere energiebronnen steeds onzekerder worden staan overgrote meerderheid achter de van de maanden vlak voor werd een in nationale stemming over de verworpen en een oproep voor algemene landelijke staking men of daaraan gehoor gegeven zal worden is nog maar de vraag in ligt het de meeste van de vijfentwintig in dit gebied hebben tot toe werkt tijdens de stakingsperiode bit de zes mijnen die dinsdagochtend volgens schema weer moesten werken na de paasvakantie mijnwerkers ondanks de de posters om gewoon aan het werk te gaan morgen zoden de andere mijnen in het gebied weer aan het werk moeten gaan mijnwerkers en arbeiders de blijven conflicten bestaan de stakers willen geen aan de hoogovens hierin ze door havenarbeiders die weigeren schepen met kolen te lossen de zijn bang dat de staking van fabrieken zo bij het is de het de beseft terdege dat van een ernstige aantasting van economie zo zijn de stelt zich in dit geval dan ook op,p,NG,Y
600,183,2972,2972,/Users/leonardovida/dev/HistAware/data/raw/delpher/1980s/1981/09-17/DDD_011008347/DDD_011008347_0069_articletext.xml,DDD_011008347_0069_articletext.xml,2,1981-09-17,/Users/leonardovida/dev/HistAware/data/raw/delpher/1980s/1981/09-17/DDD_011008347,coal,1264752,4000.0,/Users/leonardovida/dev/HistAware/data/raw/delpher/1980s/1981/09-17/DDD_011008347/DDD:ddd:011008347:mpeg21.didl.xml.gz.xml,DDD:ddd:011008347:mpeg21.didl.xml.gz.xml,Groningen,1981-09-17,218.0,nl,Nieuwenhuis,Groninger archieven,Nieuwsblad van het Noorden,94.0,0.0469473004944056,"- Omdat de kolen bij hoge temperatuur (1400 graden Celsius) volledig omgezet worden, zijn er. geen bijprodukten als teer. Het gas heeft een buitengewoon laag zwavelgehalte en is zeer geschikt als brandstof en als grondstof voor verschillende chemische processen. Dit zeer schone Humboldt-proces zal worden uitgeprobeerd in een installatie, die tien ton kolen per uur verbruikt. Men hoopt d§?e installatie eind volgend jaar in bedrijf te nemen.",omdat de kolen bij hoge graden volledig omgezet worden zijn er geen als teer het gas heeft een laag en is zeer geschikt als brandstof en als grondstof voor verschillende chemische processen dit zeer schone zal worden in een installatie die tien ton kolen per men hoopt installatie eind volgend jaar in bedrijf te nemen,p,PO,Y
607,208,3377,3377,/Users/leonardovida/dev/HistAware/data/raw/delpher/1980s/1981/07-24/DDD_010627519/DDD_010627519_0007_articletext.xml,DDD_010627519_0007_articletext.xml,2,1981-07-24,/Users/leonardovida/dev/HistAware/data/raw/delpher/1980s/1981/07-24/DDD_010627519,coal,1139756,3568.0,/Users/leonardovida/dev/HistAware/data/raw/delpher/1980s/1981/07-24/DDD_010627519/DDD:ddd:010627519:mpeg21.didl.xml.gz.xml,DDD:ddd:010627519:mpeg21.didl.xml.gz.xml,Amersfoort,1981-07-24,8779.0,nl,Stichting Nederlands Dagblad,Nederlands Dagblad,Nederlands dagblad : gereformeerd gezinsblad / hoofdred. P. Jongeling ... [et al.],37.0,0.0478481979301364,"Dat is de conclusie van het rapport „Kolen als Industriële brandstof', dat het ECN (stichting energieonderzoek centrum Nederland) in Petten heeft gemaakt in opdracht van het ministerie van economische zaken. Het rapport behelst een studie naar de inzetmogelijkheden van steenkool voor de toekomstige energievoorziening van de Nederlandse industrie.",dat is de van het rapport kolen als brandstof dat het stichting in petten heeft gemaakt in opdracht van het ministerie van economische zaken het rapport behelst een naar de van steenkool voor de toekomstige energievoorziening van de,p,NE,Y
611,153,2458,2458,/Users/leonardovida/dev/HistAware/data/raw/delpher/1980s/1982/06-24/DDD_010377885/DDD_010377885_0041_articletext.xml,DDD_010377885_0041_articletext.xml,2,1982-06-24,/Users/leonardovida/dev/HistAware/data/raw/delpher/1980s/1982/06-24/DDD_010377885,coal,5774042,18655.0,/Users/leonardovida/dev/HistAware/data/raw/delpher/1980s/1982/06-24/DDD_010377885/DDD:ddd:010377885:mpeg21.didl.xml.gz.xml,DDD:ddd:010377885:mpeg21.didl.xml.gz.xml,Amsterdam,1982-06-24,171.0,nl,s.n.,KB C 157,De waarheid,42.0,0.0420409814173871,"De bedoeling is dat in 1990 ongeveer 40 procent van de elektriciteit in ons land weer met steenkool wordt opgewekt. Daarvoor is jaarlijks zon tien miljoen ton steenkool nodig. Om niet volledig afhankelijk te worden van buitenlandse afnemers willen de elektriciteitsbedrijven zelf deel gaan nemen in de kolenwinning. Hiertoe is samen met Hoogovens en DSM een speciale onderneming opgericht, Holland Carbon Fuels.",de bedoeling is dat in ongeveer procent van de elektriciteit in ons land weer met steenkool wordt opgewekt daarvoor is jaarlijks tien miljoen ton steenkool nodig om niet volledig afhankelijk te worden van afnemers willen de elektriciteitsbedrijven zelf deel gaan nemen in de hiertoe is samen met hoogovens en een speciale onderneming opgericht carbon fels,p,PO,Y
613,89,1263,1263,/Users/leonardovida/dev/HistAware/data/raw/delpher/1980s/1980/05-28/DDD_011019038/DDD_011019038_0058_articletext.xml,DDD_011019038_0058_articletext.xml,2,1980-05-28,/Users/leonardovida/dev/HistAware/data/raw/delpher/1980s/1980/05-28/DDD_011019038,coal,3219340,10466.0,/Users/leonardovida/dev/HistAware/data/raw/delpher/1980s/1980/05-28/DDD_011019038/DDD:ddd:011019038:mpeg21.didl.xml.gz.xml,DDD:ddd:011019038:mpeg21.didl.xml.gz.xml,Groningen,1980-05-28,124.0,nl,Nieuwenhuis,Groninger archieven,Nieuwsblad van het Noorden,93.0,0.0250399770757329,"Bij de hele Nederlandse industrie staat nu een warmte-kracht-vermogen opgesteld van ruim 1000 mW, aldus drs. W. H. J. Tieleman, directeurgeneraal voor Energie van het ministerie van Economische Zaken. En dat vermogen zal groeien, al was het alleen al door de groeiende behoefte aan warmte (stoom en hete olie) in de industrie. Daarnaast speelt de stijgende olieprijs een belangrijke rol: al bij de huidige olieprijzen hebben veel warmte-kracht-projecten zich al in enkele jaren terugverdiend. Het nu bestaande warmtekrachtvermogen wordt echter geproduceerd met olie en aardgas. En een toenemende inzet van olie noemt drs. Tieleman onaanvaardbaar. Een toenemende inzet van aardgas moet per project worden beoordeeld, waarbij de warmte-kracht-koppeling wegens zijn hoge rendement wel geldt als een hoogwaardige toepassing, waarvoor in beginsel tien miljard kubieke meter aardgas voor de komende tien jaar beschikbaar is. Steenkool als brandstof is nog geen alternatief: daarvoor moet eerst de wervelbedverbranding en de kolenvergassing verder zijn ontwikkeld en zulks verwacht drs. Tieleman pas over vijf tot tien jaar. Voor in verhouding kleinschalige toepassing in warmte-krachtpinstallaties komt steenkool door de hoge investeringen waarschijnlijk nooit in aanmerking.",bij de hele staat een opgesteld van voor energie van het ministerie van economische zaken en dat vermogen zal groeien al was het alleen al door de groeiende behoefte aan warmte stoom en hete olie in de daarnaast speelt de stijgende olieprijs een belangrijke rol al bij de hebben veel zich al in enkele jaren het bestaande wordt echter met olie en aardgas en een toenemende inzet van olie noemt onaanvaardbaar een toenemende inzet van aardgas moet per project worden beoordeeld waarbij de wegens zijn hoge rendement wel geldt als een hoogwaardige toepassing waarvoor in beginsel tien miljard meter aardgas voor de komende tien jaar beschikbaar is steenkool als brandstof is nog geen alternatief daarvoor moet eerst de en de verder zijn ontwikkeld en verwacht pas over vijf tot tien jaar voor in kleinschalige toepassing in komt steenkool door de hoge investeringen waarschijnlijk nooit in aanmerking,p,NG,Y
616,56,946,946,/Users/leonardovida/dev/HistAware/data/raw/delpher/1980s/1982/12-31/DDD_010627958/DDD_010627958_3827_articletext.xml,DDD_010627958_3827_articletext.xml,3,1982-12-31,/Users/leonardovida/dev/HistAware/data/raw/delpher/1980s/1982/12-31/DDD_010627958,coal,5629781,18158.0,/Users/leonardovida/dev/HistAware/data/raw/delpher/1980s/1982/12-31/DDD_010627958/DDD:ddd:010627958:mpeg21.didl.xml.gz.xml,DDD:ddd:010627958:mpeg21.didl.xml.gz.xml,Amersfoort,1982-12-31,9219.0,nl,Stichting Nederlands Dagblad,Nederlands Dagblad,Nederlands dagblad : gereformeerd gezinsblad / hoofdred. P. Jongeling ... [et al.],39.0,0.0366472117593902,"westerse landen. Met een voorbeeld kan duidelijk gemaakt worden hoezeer het land zijn uitvoer tracht te vergroten. Terwijl de Zuidafrikanen enkele jaren geleden nog „maar"" twintig miljoen ton steenkool uitvoerden, zal de uitvoer van dit produkt binnenkort opgelopen zijn tot 44 miljoen ton. Ook op het punt van de energievoorziening steekt de situatie waarin Zuid-Afrika verkeert gunstig af tegen die van andere landen. Alle benodigde elektriciteit voor binnenlands gebruik wordt verkregen uit steenkool of wordt opgewekt door middel van water. Alleen de Zuidafrikaanse vervoerssector is nog afhankelijk van de ingevoerde olie. Zuid-Afrika beschikt zelf niet over oliebronnen, maar vanwege de vijandige houding van verschillende leveranciers werd al in de jaren vijftig besloten een raffinaderij te bouwen waarmee olie uit steenkool gewonnen kan worden. Het ligt niet in de bedoeling in alle sectoren zelfverzorgend te worden, maar wel willen de Zuidafrikanen geheel onafhankelijk van anderen worden waar het de zogenoemde strategische goederen betreft.",westerse landen met een voorbeeld kan gemaakt worden hoezeer het land zijn tracht te vergroten terwijl de enkele jaren geleden nog maar twintig miljoen ton steenkool zal de van dit binnenkort opgelopen zijn tot miljoen ton ook op het van de energievoorziening steekt de waarin verkeert af tegen die van andere landen alle benodigde elektriciteit voor binnenlands wordt verkregen steenkool of wordt opgewekt door middel van water alleen de is nog afhankelijk van de ingevoerde olie beschikt zelf niet over maar vanwege de vijandige van verschillende leveranciers werd al in de jaren vijftig besloten een raffinaderij te waarmee olie steenkool gewonnen kan worden het ligt niet in de bedoeling in alle sectoren te worden maar wel willen de geheel onafhankelijk van anderen worden waar het de zogenoemde strategische goederen betreft,p,PO,Y
627,125,1978,1978,/Users/leonardovida/dev/HistAware/data/raw/delpher/1980s/1989/01-21/DDD_010642538/DDD_010642538_0007_articletext.xml,DDD_010642538_0007_articletext.xml,2,1989-01-21,/Users/leonardovida/dev/HistAware/data/raw/delpher/1980s/1989/01-21/DDD_010642538,coal,4097417,,,,,,,,,,,,0.0453021784689435,"Colombia is ook een belangrijke kolen- producent. Volgens plan zal men dit jaar 11,5 miljoen ton kolen uitvoeren tot een prijs van 37,50 dollar per ton. De opbrengst uit dit export- product komt volgens <de minister uit op 431 miljoen dollar. Verleden jaar exporteerde Colombia minder dan negen miljoen ton.",is ook een belangrijke volgens plan zal men dit jaar miljoen ton kolen tot een prijs van dollar per ton de opbrengst dit komt volgens de minister op miljoen dollar verleden jaar exporteerde minder dan negen miljoen ton,p,PO,Y
631,174,2857,2857,/Users/leonardovida/dev/HistAware/data/raw/delpher/1980s/1985/10-16/DDD_010611453/DDD_010611453_0090_articletext.xml,DDD_010611453_0090_articletext.xml,2,1985-10-16,/Users/leonardovida/dev/HistAware/data/raw/delpher/1980s/1985/10-16/DDD_010611453,coal,4826549,15430.0,/Users/leonardovida/dev/HistAware/data/raw/delpher/1980s/1985/10-16/DDD_010611453/DDD:ddd:010611453:mpeg21.didl.xml.gz.xml,DDD:ddd:010611453:mpeg21.didl.xml.gz.xml,Heerlen,1985-10-16,244.0,nl,Nieuwe Limburger koerier;Uitgeversmaatschappĳ Limburgs Dagblad,KB C 101,Limburgsch dagblad,67.0,0.0373864276703392,"De reis werd gemaakt op uitnodiging van het 'Standing Committee' (dagelijks bestuur) van het National People's Congress van China. Dat is de volsvertegenwoordiging waarin 2978 afgevaardigden zitting hebben. „We zijn bijzonder hartelijke ontvangen, men heeft ons op een zeer open wijze benaderd. Dat was te proeven in de officiële toespraken, maar zeer zeker ook in de persoonlijke gesprekken met de diverse Chinese functionarissen. Het land heeft sinds de hervormingen een enorm proces meegemaakt, gericht op de'groei van de economie en de welvaart. Met groot enthousiasme zet men er nieuwe ontwikkelingen in gang en daarbij maakt China gebruikt van westerse technologieën, omdat men zelf daar niet over beschikt. Er worden 'joint ventures' opgericht zodat met Westerse westenschap, maar onder Chinese condities in China geproduceerd kan worden. Men heeft er een heel praktische kijk op deze ontwikkeling, maar er doen zich problemen voor,"" aldus Rene van der Linden. Die problemen liggen volgens hem op het vlak van de energieverzorging en de zorg om de stabiliteit van het land. „Het land heeft enorme voorraden kolen, olie, gas, maar men heeft de technische kennis niet om deze energie te exploiteren. Daarnaast is de overheid erg bang of de ontwikkeling wel in de hand gehouden kan worden. In een land met één miljard inwoners is stabiliteit een belangrijke factor. Daarvan is men zich wel bewust."" China wil het probleem van de energie oplossen door de bouw van een reeks nucleaire centrales voor de opwekking van elektriciteit. Tegelijkertijd is men echter enorm geïnteresseerd in het proces van ondergrondse vergassing van steenkool. De technische kennis daaromtrent zou men bijvoorbeeld uit Nederland willen verkrijgen. Verder stellen de Chinezen belang in onze landbouw en veeteelt en de aanleg van havens. „Er liggen mogelijkheden die Nederland nu moet benutten. Als we het nu laten afweten missen we een enorme kans. De handel met China neemt toe, maar Nederland moet nog sterker vertegenwoordigd worden in dit land, dat binnen de kortste keren zal uitgroeien tot een zeer dominante mogendheid in Azië. China wil met ons handel drijven, het is een absolute noodzaak dat we meedoen,"" meent de CDA-er. Enkele bedrijven uit Nederland hebben reeds contacten met China, waaronder Océ-Van der Grinten (papier) en DSM (grondstof voor plastics). Volgens Rene van der Linden moet er - naast uitbreiding van de handel en de handelscontacten - een programma komen voor uitwisselingen van studenten tussen China en Nederland. Verder moeten er handelsmissies gestuurd worden, moet meer gewicht gegeven worden aan de gemengde commissie China-Nederland, moet een uitwisseleing van experts plaatsvinden, moet de Nederlandse ambassade in China uitgebreid worden (er werken nu vier man) en moet er een relatie tot stand gebracht worden met China in EEG-verband. De Open deur-politiek van China biedt én het land zelf, maar ook de handelspartners veel mogelijkheden. China blijft echter wel condities stellen voor de manier waarop in China gewerkt mag en kan worden. De deur naar het Westen is weliswaar opengemaakt, maar de Chinezen kijken wel zeer nauwkeurig wie daardoor naar binnen wil. Volgens president Li Xiannian wordt in China het socialisme voor de volle 100 procent gepractizeerd, een wat vrijere economie en een zekere privatisering hebben volgens hem tot gevolg dat de staatsbedrijven enige concurrentie ondervinden hetgeen de vitalisering van het land tot gevolg heeft. China experimenteert verder in vier zogenoemde 'economische zones' met een nog verdergaande economische vrijheid. De Nederlandse parlementariërs bezochten Shenzhen, een economische zone die tegen Hong Kong aanligt. „Een wonder als je dat ziet. In vijf jaar tijd is het aantal inwoners van die zone gestegen van 35.000 tot 300.000. Er wordt in een enorm tempo gebouwd. Fabrieken worden uit de grond gestampt. Er zijn 4200 contracten voor zogenoemde 'joint ventures' afgesloten; een investeringswaarde van 3 miljard US Dollar, waarvan nu 0,8 miljard is geïnvesteerd. De bedrijven die er zich vestigen hebben een enorm voordeel op Hong Kong. Slechts 40 procent van de loonkosten en slechts 30 procent van de grondprijs. Er is een enorm belastingvoordeel. Tweederde van de producten die er gemaakt worden is voor de uitvoer, éénderde moet naar China zelf. Nederland is er vertegenwoordigd door Philips. Je kunt er alleen maar hoogstverbaasd rondlopen. Het is een wonder hoe dat daar toegaat,"" vertelt Van der Linden enthousiast. De delegatie van kamerleden zal een verslag maken van deze parlementaire reis en dat aanbieden aan de Tweede en Eerste Kamer. De bedoeling is om naar aanleiding van dat verslag gesprekken aan te gaan met de minister van Buitenlandse Zaken om te bekijken wat er gedaan kan worden aan de verbetering van de betrekkingen van beide landen.",de reis werd gemaakt op van het dagelijks van het van dat is de waarin afgevaardigden zitting hebben we zijn bijzonder hartelijke ontvangen men heeft ons op een zeer open wijze benaderd dat was te proeven in de toespraken maar zeer zeker ook in de persoonlijke gesprekken met de diverse het land heeft sinds de hervormingen een enorm proces meegemaakt gericht op van de economie en de welvaart met groot zet men er ontwikkelingen in gang en daarbij maakt van westerse technologie omdat men zelf daar niet over beschikt er worden opgericht zodat met westerse maar onder condities in kan worden men heeft er een heel praktische kijk op deze ontwikkeling maar er doen zich problemen voor van der linden die problemen liggen volgens hem op het vlak van de en de zorg om de stabiliteit van het land het land heeft enorme voorraden kolen olie gas maar men heeft de technische kennis niet om deze energie te exploiteren daarnaast is de overheid erg bang of de ontwikkeling wel in de hand kan worden in een land met miljard inwoners is stabiliteit een belangrijke factor daarvan is men zich wel wil het probleem van de energie oplossen door de van een reeks centrales voor de opwekking van elektriciteit tegelijkertijd is men echter enorm ge in het proces van ondergrondse vergassing van steenkool de technische kennis daaromtrent zo men bijvoorbeeld willen verkrijgen verder stellen de chinezen belang in onze en veeteelt en de aanleg van havens er liggen mogelijkheden die moet als we het laten afweten missen we een enorme kans de handel met neemt toe maar moet nog sterker vertegenwoordigd worden in dit land dat binnen de kortste keren zal tot een zeer dominante mogendheid in wil met ons handel drijven het is een noodzaak dat we meedoen meent de enkele bedrijven hebben reeds contacten met waaronder der grinten papier en grondstof voor plastics volgens van der linden moet er naast van de handel en de een programma komen voor van en verder moeten er handelsmissies worden moet meer gewicht gegeven worden aan de gemengde commissie moet een van experts plaatsvinden moet de ambassade in worden er werken vier man en moet er een relatie tot stand gebracht worden met in de open van biedt het land zelf maar ook de handelspartners veel mogelijkheden blijft echter wel condities stellen voor de manier waarop in gewerkt mag en kan worden de der naar het westen is weliswaar opengemaakt maar de chinezen kijken wel zeer wie daardoor naar binnen wil volgens president wordt in het socialisme voor de volle procent een wat vrijere economie en een zekere privatisering hebben volgens hem tot gevolg dat de staatsbedrijven enige ondervinden hetgeen de van het land tot gevolg heeft experimenteert verder in vier zogenoemde zones met een nog economische vrijheid de bezochten een economische zone die tegen aanligt een wonder als je dat ziet in vijf jaar tijd is het aantal inwoners van die zone gestegen van tot er wordt in een enorm tempo fabrieken worden de grond gestampt er zijn contracten voor zogenoemde afgesloten een van miljard dollar waarvan miljard is ge de bedrijven die er zich vestigen hebben een enorm voordeel op slechts procent van de en slechts procent van de grondprijs er is een enorm belastingvoordeel tweederde van de die er gemaakt worden is voor de moet naar zelf is er vertegenwoordigd door je er alleen maar rondlopen het is een wonder hoe dat daar toegaat vertelt van der linden de delegatie van zal een verslag maken van deze parlementaire reis en dat aanbieden aan de tweede en eerste kamer de bedoeling is om naar aanleiding van dat verslag gesprekken aan te gaan met de minister van zaken om te bekijken wat er gedaan kan worden aan de verbetering van de betrekkingen van beide landen,p,NG,Y
635,168,2682,2682,/Users/leonardovida/dev/HistAware/data/raw/delpher/1980s/1988/09-23/DDD_010566763/DDD_010566763_0210_articletext.xml,DDD_010566763_0210_articletext.xml,2,1988-09-23,/Users/leonardovida/dev/HistAware/data/raw/delpher/1980s/1988/09-23/DDD_010566763,coal,241418,,,,,,,,,,,,0.0374687014235768,"Jaarlijks komt volgens Kairos vijf tot zes miljoen ton Zuidafrikaanse steenkool aan in de Nederlandse havens, waarvan het overgrote deel in Rotterdam. Ongeveer 3,5 miljoen ton verlaat ons land weer, vooral naar West- Duitsland en Groot-Brittannië. De Nederlandse invoer van Zuidafrikaanse steenkool is tussen 1982 en 1986 verzesvoudigd tot bijna 1,5 miljoen ton per jaar. Volgens Kairos wordt, in tegenstelling tot wat minister vanmiitenlandse zaken Van den Broek beweert, een aanzienlijk deel hier verstookt.",jaarlijks komt volgens vijf tot zes miljoen ton steenkool aan in de havens waarvan het overgrote deel in ongeveer miljoen ton verlaat ons land weer vooral naar en de invoer van steenkool is en tot bijna miljoen ton per jaar volgens wordt in tegenstelling tot wat minister zaken van broek beweert een aanzienlijk deel hier verstookt,p,NE,Y
