,Unnamed: 0,Unnamed: 0.1,Unnamed: 0.1.1,article_filepath,article_name,count,date,dir,energy_type,index_article,index_metadata,metadata_filepath,metadata_title,newspaper_city,newspaper_date,newspaper_issuenumber,newspaper_language,newspaper_publisher,newspaper_source,newspaper_title,newspaper_volume,accuracy_selection,text,text_clean,type,sentiment,energy
205,158,2525,2525,/Users/leonardovida/dev/HistAware/data/raw/delpher/1980s/1982/02-13/DDD_011205995/DDD_011205995_0949_articletext.xml,DDD_011205995_0949_articletext.xml,2,1982-02-13,/Users/leonardovida/dev/HistAware/data/raw/delpher/1980s/1982/02-13/DDD_011205995,coal,5766358,18628.0,/Users/leonardovida/dev/HistAware/data/raw/delpher/1980s/1982/02-13/DDD_011205995/DDD:ddd:011205995:mpeg21.didl.xml.gz.xml,DDD:ddd:011205995:mpeg21.didl.xml.gz.xml,Amsterdam,1982-02-13,29277.0,nl,Dagblad De Telegraaf,Koninklijke Bibliotheek C 98,De Telegraaf,89.0,0.0457267039357275,"De Hilversummer Chrisian Boelens (50), wiens aritectenbureau de leiding er het project heeft, twijtt er niet aan dat in die tijd 'n 6 miljoen mensen uit 36 derlandse steden zich aan n tentoonstelling „Zon = lergie"" komen vergapen. Met behulp van de mornste technische snufjes laserstralen, diaprojecs cn videobanden wordt in een wervelende show orgeschoteld. Met eigen en kunnen zij zo aanschou;n hoe de olie-, kolen- en sstroom zich via tankers, Dorwegen en pijpleidingen weegt tussen de levensoot op de (blauwe) wereld-1 geschilderde contineni, waarboven de zonnesalieten die in de toekomst illicht een deel van onze ergievoorziening gaan ver-gen al zichtbaar zijn aan t firmament en waarin kosten bij tijd en wijle hun rige baan trekken. 3n de gemeenten, die de itoonstelling aandoet (gezen is voor plaatsen met nstens 50.000 inwoners), den met de kleuren van de derlandse vlag getooide uidswagens onophoudec rond om iedereen op te ?pen (gratis) al dit en nog el meer fraais te komen wonderen. Schoolklassen' irden per bus aangevoerd krijgen een — aan de leefi aangepast — programma presenteerd. \rchitect Boelens staan bij alles twee zaken voor ;n. Ten eerste wil hij heel derland nu eens op een en fascinerende als simpemanier aan het verstand :ngen, hoe dat veelbesproi energieprobleem nu eitlijk in elkaar zit. Maar veel meer is het hem er om begonnen te laten zien, hoe eenvoudig iedereen er een handje aan kan meehelpen, dat de wereld wat langer toe kan met de schaarse en zo broodnodige brandstoffen waarover we nog beschikken. „Het gaat er om,"" zo zegt de initiatiefnemer van het gebeuren, „dat de mensheid minstens 50 jaar de tijd krijgt om nieuwe energiedragers, zoals kernfusie, windmolens, getijden- en zonne-energie te ontwikkelen. Een heleboel prototypes daarvan zijn trouwens al op onze expositie te zien. In die jaren moeten er door de overheden ook nieuwe beleidslijnen op het gebied van energiewinning en - gebruik worden ontworpen. „Tegenwoordig,"" zo vertelt hij, „verbruiken we per dag ongeveer 60 maal zoveel energie als de 100 Watt, die ons eigen lichaam levert. Op die manier maken we in één jaar op, waar de zon een miljoen jaar voor heeft moeten schijnen om het in de vorm van kolen, olie en andere brandstoffen op aarde bij elkaar te krijgen."" „Het is"", zo geeft de Hilversumse architect toe, ~zek'er geen nieuwe boodschap, die we brengen. Maar we presenteren hem wel in een heel aantrekkelijke en originele bonbonverpakking. Het energieprobleem is immers zo ingewikkeld, dat de gemiddelde mens er geen snars van begrijpt. Die weet toch op geen stukken na, wat al die instanties en organisaties als SVEN, VEGIN, VEEN en noem ze maar op, in ons land al allemaal doen aan energiebesparing. Bij ons wordt de mensen duidelijk gemaakt hoe die groepen allemaal opereren en vooral ook op welke manier ze samenwerken. Volgens Boelens zal de helft van de 1500 vierkante meter tentoonstellingsruimte die de van een soort brandveilig plastic vervaardigde globe biedt, straks in beslag worden genomen door allerhande overheidsinstanties, terwijl hét bedrijfsleven over de overige 50 procent kan beschikken om zijn informatie aan het publiek kwijt te raken. Op die manier zullen overheid en industrie ook gezamenlijk de ƒ 4 1/2 miljoen, die de tentoonstelling kost, moeten opbrengen. „Het is zeker niet de bedoeling, dat allerlei producenten elkaar op onze expositie gaan beconcurreren. Daarom hebben we in principe contact gezocht met fabrikantenverenigingen. Die laten dan bijvoorbeeld één verwarmingsketel met een hoog rendement zien, zodat de mensen zich van het voordeel van zo'n ding boven een conventionele ketel op de hoogte kunnen stellen. Vervolgens kunnen ze dan eventueel verder informeren wie dat soort apparatuur maakt."" Boelens zegt zich er heel goed van bewust te zijn, dat elke zichzelf respecterende gemeente tegenwoordig over een eigen centrum voor informatie op het gebied van energie beschikt. „Maar de cijfers wijzen uit,"" vertelt hij, ~dat daar maar 3,2 procent van de bevolking komt. Alleen iemand wiens geiser ontploft is, gaat daar heen om tc informeren wat hij nu moet kopen. Wat wij proberen, is die overige 96% te bereiken.""",de wiens de leiding er het project heeft er niet aan dat in die tijd miljoen mensen steden zich aan tentoonstelling komen vergapen met van de technische videobanden wordt in een wervelende show met eigen en zij zo hoe de en zich via tankers en pijpleidingen weegt de op de geschilderde waarboven de die in de toekomst een deel van onze gaan al zichtbaar zijn aan firmament en waarin kosten bij tijd en wijle baan trekken de gemeenten die de aandoet is voor plaatsen met inwoners met de kleren van de vlag getooide rond om iedereen op te pen gratis al dit en nog el meer te komen wonderen schoolklassen per aangevoerd krijgen een aan de aangepast programma staan bij alles twee zaken voor ten eerste wil hij heel eens op een en fascinerende als aan het verstand hoe dat in elkaar zit maar veel meer is het hem er om begonnen te laten zien hoe iedereen er een handje aan kan meehelpen dat de wereld wat langer toe kan met de schaarse en zo broodnodige brandstoffen waarover we nog beschikken het er om zo zegt de initiatiefnemer van het dat de mensheid minstens jaar de tijd krijgt om zoals windmolens en zonne-energie te ontwikkelen een heleboel prototypes daarvan zijn al op onze expositie te zien in die jaren moeten er door de overheden ook beleidslijnen op het gebied van en worden ontworpen tegenwoordig zo vertelt hij we per dag ongeveer maal zoveel energie als de watt die ons eigen lichaam levert op die manier maken we in jaar op waar de een miljoen jaar voor heeft moeten schijnen om het in de vorm van kolen olie en andere brandstoffen op aarde bij elkaar te krijgen het is zo geeft de architect toe geen boodschap die we brengen maar we presenteren hem wel in een heel aantrekkelijke en originele het is immers zo ingewikkeld dat de gemiddelde mens er geen snars van begrijpt die weet toch op geen na wat al die instanties en organisaties als veen en noem ze maar op in ons land al allemaal doen aan energiebesparing bij ons wordt de mensen gemaakt hoe die groepen allemaal opereren en vooral ook op welke manier ze samenwerken volgens zal de helft van de vierkante meter die de van een soort brandveilig plastic vervaardigde globe biedt straks in beslag worden genomen door allerhande overheidsinstanties terwijl bedrijfsleven over de overige procent kan beschikken om zijn informatie aan het kwijt te raken op die manier overheid en ook gezamenlijk de miljoen die de tentoonstelling kost moeten opbrengen het is zeker niet de bedoeling dat allerlei elkaar op onze expositie gaan daarom hebben we in principe contact gezocht met die laten dan bijvoorbeeld verwarmingsketel met een hoog rendement zien zodat de mensen zich van het voordeel van zo ding boven een conventionele ketel op de hoogte stellen vervolgens ze dan verder informeren wie dat soort maakt zegt zich er heel goed van te zijn dat elke zichzelf respecterende gemeente tegenwoordig over een eigen voor informatie op het gebied van energie beschikt maar de cijfers wijzen vertelt hij daar maar procent van de bevolking komt alleen iemand wiens geiser ontploft is daar heen om informeren wat hij moet kopen wat wij proberen is die overige te bereiken,p,PO,Y
207,123,1749,1749,/Users/leonardovida/dev/HistAware/data/raw/delpher/1980s/1984/10-11/DDD_010378738/DDD_010378738_0111_articletext.xml,DDD_010378738_0111_articletext.xml,6,1984-10-11,/Users/leonardovida/dev/HistAware/data/raw/delpher/1980s/1984/10-11/DDD_010378738,gas,7043661,22976.0,/Users/leonardovida/dev/HistAware/data/raw/delpher/1980s/1984/10-11/DDD_010378738/DDD:ddd:010378738:mpeg21.didl.xml.gz.xml,DDD:ddd:010378738:mpeg21.didl.xml.gz.xml,Amsterdam,1984-10-11,271.0,nl,s.n.,KB C 157,De waarheid,44.0,0.0479352947055364,"De gasprijs voor de tuinbouw is gekoppeld aan de prijs voor stookolie. Dat betekende tot nu toe dat bijvoorbeeld de milieuheffing die op stookolie rust tevens doorwerkte in de gasprijs. In het nieuwe akkoord zijn die oneigenlijke heffingen uit de gasprijs verdwenen, maar de koppeling aan (gedeeltelijk) ontzwavelde stookolie is gehandhaafd. Het Landbouwschap had onder meer geëist dat in de bepaling van de gasprijs niet alleen de olieprijs maar ook de kolenprijs zou meetellen. In andere EG-landen stappen tuinders nu al over op kolen. En ook voor de tuinders hier is kolenvergassing een mogelijk alternatief als het aardgas te duur wordt. „De Gasunie en de Vegin zijn als de dood dat we massaal op kolen overstappen. In België bijvoorbeeld gebeurt dat al veel. Daar kan het ook wat gemakkelijker omdat daar minder strenge eisen aan kolenvergassingsinstallaties worden gesteld"", aldus Arent Mostert.",de gasprijs voor de is gekoppeld aan de prijs voor stookolie dat betekende tot toe dat bijvoorbeeld de die op stookolie tevens doorwerkte in de gasprijs in het akkoord zijn die oneigenlijke heffingen de gasprijs verdwenen maar de koppeling aan gedeeltelijk stookolie is gehandhaafd het had onder meer ge dat in de bepaling van de gasprijs niet alleen de olieprijs maar ook de zo meetellen in andere stappen al over op kolen en ook voor de hier is een mogelijk alternatief als het aardgas te wordt de en de zijn als de dood dat we massaal op kolen overstappen in bijvoorbeeld dat al veel daar kan het ook wat gemakkelijker omdat daar minder strenge eisen aan worden gesteld,p,NE,Y
208,225,4719,4719,/Users/leonardovida/dev/HistAware/data/raw/delpher/1980s/1982/12-31/DDD_010593209/DDD_010593209_0125_articletext.xml,DDD_010593209_0125_articletext.xml,1,1982-12-31,/Users/leonardovida/dev/HistAware/data/raw/delpher/1980s/1982/12-31/DDD_010593209,coal,5626642,18156.0,/Users/leonardovida/dev/HistAware/data/raw/delpher/1980s/1982/12-31/DDD_010593209/DDD:ddd:010593209:mpeg21.didl.xml.gz.xml,DDD:ddd:010593209:mpeg21.didl.xml.gz.xml,Heerlen,1982-12-31,308.0,nl,Nieuwe Limburger koerier;Uitgeversmaatschappĳ Limburgs Dagblad,KB C 101,Limburgsch dagblad,64.0,0.0369796785115693,"De inzet van uranium bij de opwekking van elektriciteit zal volgens het GPV-scenario vier procent bedragen. Als er echter geen afdoende oplossing voor de verwerking van het kernsplijtingsafval komt, zal dit aandeel dalen tot twee procent. De brandstof die de elektriciteitscentrales tegen de eeuwwisseling gaan gebruiken, zal voor 19 procent bestaan uit uranium. 'Voorts bestaat deze voor 43 procent uit aardgas, 29 procent uit kolen en 9 procent uit alternatieve energiebronnen, zoals zon en wind. Overigens is de stichting van mening dat de inzet van alternatieve energiebronnen de komende jaren zeer langzaam op gang zal komen. Het aandeel van deze bronnen in de totale energiebalans in het jaar 2000 zal slechts 7 procent bedragen.",de inzet van bij de opwekking van elektriciteit zal volgens het vier procent bedragen als er echter geen afdoende oplossing voor de verwerking van het komt zal dit aandeel dalen tot twee procent de brandstof die de elektriciteitscentrales tegen de gaan zal voor procent bestaan bestaat deze voor procent aardgas procent kolen en procent alternatieve energiebronnen zoals en wind overigens is de stichting van mening dat de inzet van alternatieve energiebronnen de komende jaren zeer langzaam op gang zal komen het aandeel van deze bronnen in de totale energiebalans in het jaar zal slechts procent bedragen,p,NE,Y
210,78,1150,1150,/Users/leonardovida/dev/HistAware/data/raw/delpher/1980s/1982/07-15/DDD_010377850/DDD_010377850_0126_articletext.xml,DDD_010377850_0126_articletext.xml,2,1982-07-15,/Users/leonardovida/dev/HistAware/data/raw/delpher/1980s/1982/07-15/DDD_010377850,coal,5818924,18809.0,/Users/leonardovida/dev/HistAware/data/raw/delpher/1980s/1982/07-15/DDD_010377850/DDD:ddd:010377850:mpeg21.didl.xml.gz.xml,DDD:ddd:010377850:mpeg21.didl.xml.gz.xml,Amsterdam,1982-07-15,189.0,nl,s.n.,KB C 157,De waarheid,42.0,0.0243035227357381,"Op een persconferentie in Den Haag wees minister Terlouw op het grote verschil dat is ontstaan tussen de elektriciteitsprijzen in Nederland en onze voornaamste Europese concurrenten West-Duitsland en Frankrijk. In de Bondsrepubliek betaalt de industrie gemiddeld 60 procent minder. Dit komt volgens de bewindsman voornamelijk doordat onze oosterburen de beschikking hebben over grote hoeveelheden goedkope bruinkool voor de opwekking van elektriciteit. De meeste Nederlandse centrales gebruiken dure olie en aardgas. Het prijsverschil met Frankrijk en België is nog groter. Dit zou komen doordat beide landen steeds meer kernenergie gebruiken. „Je kunt je natuurlijk afvragen of alle kosten die zijn verbonden aan het gebruik van kernenergie ook in de prijs zijn doorberekend, maar dat prijsverschil is er nu eenmaal"", aldus minister Terlouw. Door de industrie is reeds herhaalde malen aangedrongen op de levering van goedkopere elektriciteit. Omdat de overschakeling van de Nederlandse centrales op steenkool te lang duurt, is als overbruggingsmaatregel besloten de elektriciteitscentrales tijdelijk van goedkoper aardgas te yoorzien dat gebruikt kan worden in de plaats van de dure olie. Overigens blijft ook nu nog een prijsverschil van ongeveer twee cent per kWh met West- Duitsland bestaan. De ondernemersorganisatie VNO noemt de prijsverlaging „een goede aanzet"", maar vindt dat er meer moet gebeuren. Er zijn te veel bedrijven die niet kunnen profiteren, menen de ondernemers. De extra gasafzet is, zo zei Terlouw, mogelijk geworden omdat door nieuwe vondsten de aardgasreserve „aanzienlijk"" is toegenomen en bovendien het verbruik door energiebesparingsmaatregelen en onder invloed van de economische teruggang afneemt.",op een persconferentie in wees minister op het grote verschil dat is ontstaan de in en onze voornaamste en in de betaalt de gemiddeld procent minder dit komt volgens de bewindsman voornamelijk doordat onze de beschikking hebben over grote hoeveelheden goedkope voor de opwekking van elektriciteit de meeste centrales olie en aardgas het prijsverschil met en is nog groter dit zo komen doordat beide landen steeds meer kernenergie je je afvragen of alle kosten die zijn verbonden aan het van kernenergie ook in de prijs zijn doorberekend maar dat prijsverschil is er eenmaal minister door de is reeds herhaalde malen aangedrongen op de levering van goedkopere elektriciteit omdat de overschakeling van de centrales op steenkool te lang is als besloten de elektriciteitscentrales tijdelijk van goedkoper aardgas te dat kan worden in de plaats van de olie overigens blijft ook nog een prijsverschil van ongeveer twee cent per met bestaan de ondernemersorganisatie noemt de prijsverlaging een goede aanzet maar vindt dat er meer moet er zijn te veel bedrijven die niet profiteren menen de ondernemers de extra is zo zei mogelijk geworden omdat door vondsten de aanzienlijk is toegenomen en bovendien het door en onder invloed van de economische afneemt,p,PO,Y
214,20,579,579,/Users/leonardovida/dev/HistAware/data/raw/delpher/1980s/1980/02-27/DDD_010570597/DDD_010570597_0160_articletext.xml,DDD_010570597_0160_articletext.xml,3,1980-02-27,/Users/leonardovida/dev/HistAware/data/raw/delpher/1980s/1980/02-27/DDD_010570597,coal,3680499,11976.0,/Users/leonardovida/dev/HistAware/data/raw/delpher/1980s/1980/02-27/DDD_010570597/DDD:ddd:010570597:mpeg21.didl.xml.gz.xml,DDD:ddd:010570597:mpeg21.didl.xml.gz.xml,Heerlen,1980-02-27,49.0,nl,Nieuwe Limburger koerier;Uitgeversmaatschappĳ Limburgs Dagblad,KB C 101,Limburgsch dagblad,62.0,0.0246710667131807,"HAAG - Met een grootscheepse operatie, die naar schatr-£ zes miljard zal kosten, moet ons land voor een groot deel l*ll zijn energievoorziening overschakelen op steenkool als P!andstof. In het jaar 2000 zal 40 procent van de elektrici*'tsopwekking en een deel van de gasvoorziening door kolen [feschieden. We zullen dan 26 miljoen ton steenkool per jaar pruiken (nu 1,5 miljoen ton). Dit alles om minder van olie 5f aardgas) afhankelijk te zijn.",met een grootscheepse operatie die naar zes miljard zal kosten moet ons land voor een groot deel zijn energievoorziening overschakelen op steenkool als in het jaar zal procent van de en een deel van de door kolen we dan miljoen ton steenkool per jaar miljoen ton dit alles om minder van olie aardgas afhankelijk te zijn,p,PO,Y
215,299,11852,11852,/Users/leonardovida/dev/HistAware/data/raw/delpher/1980s/1985/06-28/DDD_010565769/DDD_010565769_0540_articletext.xml,DDD_010565769_0540_articletext.xml,1,1985-06-28,/Users/leonardovida/dev/HistAware/data/raw/delpher/1980s/1985/06-28/DDD_010565769,coal,5304887,,,,,,,,,,,,0.0417178195517773,"In München werd duidelijk dal er voor het gebruik van primaire energie geen strategie op wereldschaal valt vast te stellen. In alle industrielanden spelen vijf primaire energiebronnen een belangrijke rol, te weten kolen, gas, olie, kernenergie en waterkracht. Per land hebben telkens andere energiebronnen de voorkeur In de Sowiet-Unie is aardfas op dit moment erg belangrijk en in rankrijk is er sprake van een concurrentiestrijd tussen aardgas en kernenergie. De verenigde Stalen willen zich minder afhankelijk maken van aardolie. In Noorwegen voorziet waterkracht nog in een zo grote mate in de enrgiebehoefte dat het eigen aardgas in zijn geheel wordt geëxporteerd.",in werd dal er voor het van primaire energie geen strategie op wereldschaal valt vast te stellen in alle spelen vijf primaire energiebronnen een belangrijke rol te weten kolen gas olie kernenergie en waterkracht per land hebben telkens andere energiebronnen de in de is op dit moment erg belangrijk en in is er sprake van een aardgas en kernenergie de verenigde stalen willen zich minder afhankelijk maken van aardolie in voorziet waterkracht nog in een zo grote mate in de dat het eigen aardgas in zijn geheel wordt ge,p,PO,Y
218,200,3195,3195,/Users/leonardovida/dev/HistAware/data/raw/delpher/1980s/1980/08-25/DDD_010621488/DDD_010621488_0254_articletext.xml,DDD_010621488_0254_articletext.xml,2,1980-08-25,/Users/leonardovida/dev/HistAware/data/raw/delpher/1980s/1980/08-25/DDD_010621488,coal,3187624,,,,,,,,,,,,0.0407904728749693,"Vooral dat laatste is niet eenvoudig en bovendien moet men daarbij bedenken dat er momenteel al een arbeidstekort bestaat in de Sowjet-Unie. Waar haalt men dan 'de vele duizenden extra werkkrachten nog vandaan? Om de verwachte energieproblemen te kunnen opvangen in net westelijke industriegebied, legt men daar grote nadruk op het kernenergieprogramma. Dat programma vindt niet alleen industriële toepassing, maar wordt ook al uitgeprobeerd voor bijvoorbeeld een stadsverwarmingsproject in de stad Gorki. Zijn er andere alternatieven voor het gebruik van olie en gas? De Sowjet- Unie beschikt over enorme voorraden steenkool, maar ook die bevinden zich wederom voor het grootste deel in Siberië en in het Verre-Oosten. Dat betekent dus hoge transportkosten en bovendien is men niet voorbereid op een snelle omschakeling van olie (gas) op steenkool.",vooral dat laatste is niet en bovendien moet men daarbij bedenken dat er momenteel al een arbeidstekort bestaat in de waar haalt men dan vele extra werkkrachten nog vandaan om de verwachte te opvangen in net westelijke legt men daar grote op het dat programma vindt niet alleen toepassing maar wordt ook al voor bijvoorbeeld een in de stad zijn er andere alternatieven voor het van olie en gas de beschikt over enorme voorraden steenkool maar ook die bevinden zich wederom voor het grootste deel in en in het dat betekent hoge transportkosten en bovendien is men niet voorbereid op een snelle omschakeling van olie gas op steenkool,p,NG,Y
