,Unnamed: 0,Unnamed: 0.1,Unnamed: 0.1.1,article_filepath,article_name,count,date,dir,energy_type,index_article,index_metadata,metadata_filepath,metadata_title,newspaper_city,newspaper_date,newspaper_issuenumber,newspaper_language,newspaper_publisher,newspaper_source,newspaper_title,newspaper_volume,accuracy_selection,text,text_clean,type,sentiment,energy
412,230,11948,11948,/Users/leonardovida/dev/HistAware/data/raw/delpher/1980s/1980/05-28/DDD_011019038/DDD_011019038_0060_articletext.xml,DDD_011019038_0060_articletext.xml,3,1980-05-28,/Users/leonardovida/dev/HistAware/data/raw/delpher/1980s/1980/05-28/DDD_011019038,oil,3219426,10466.0,/Users/leonardovida/dev/HistAware/data/raw/delpher/1980s/1980/05-28/DDD_011019038/DDD:ddd:011019038:mpeg21.didl.xml.gz.xml,DDD:ddd:011019038:mpeg21.didl.xml.gz.xml,Groningen,1980-05-28,124.0,nl,Nieuwenhuis,Groninger archieven,Nieuwsblad van het Noorden,93.0,0.0324190126429094,"(Van onze redacteur Kees Wiese) Nog voor de beloofde maatschappelijke discussie over onze toekomstige energievoorziening van start is gegaan en nog voor de regering haar nota over de elektriciteitsvoorziening (nog meer kolen of kernenergie) heeft uitgebracht, heeft vorige week de Nederlandse industrie een belangrijke duit in het zakje gedaan. De bouw van grote, nieuwe elektriciteitscentrales kan zeker tien jaar worden uitgesteld en van de bouw van nieuwe kolengestookte centrales volgens de gebruikelijke technologie kan zelfs helemaal worden afgezien, als. . . de industrie medeproducent mag en kan worden van elektriciteit voor het openbare net. Technisch kan zulks: de industrie zou per jaar 4000 mW kunnen produceren (ongeveer de helft van het Nederlandse elektriciteitsverbruik) en daarmee bovendien een hoeveelheid brandstof besparen gelijk aan vier miljard kubieke meter aardgas of drie miljoen ton olie, die, ingevoerd, een miljard gulden zou kosten. Wel zouden er dan in de komende tien jaar investeringen tot vijf miljard gulden nodig zijn, maar die zouden ook tussen de 25.000 en 32.000 manjaren werkgelegenheid per jaar opleveren, terwijl de elektrici teitsproduktie door de industrie nog eens blijvende werkgelegenheid voor 4000 tot 8000 man geeft. Een boeiend perspectief, dat vorige week werd geboden door ir. P. Koppend, technisch manager van Shell Nederland Raffinaderij in Pernis en ir. R. J. van Hasselt, directeur van de Vereniging Krachtwerktuigen in Amersfoort op een symposium bij de vakbeurs Petrotech (trefpunt van de internationale olie- en gasindustrie) in de Amsterdamse RAI. De Vereniging Krachtwerktuigen onderzocht door middel van een enquête bij de Nederlandse industrie de mogelijkheden voor elektriciteitsopwekking, met daarbij ongetwijfeld in het achterhoofd dat de Westduitse industrie nu al meer elektriciteit opwekt dan de totale Nederlandse elektriciteitsproduktie.",van onze kees nog voor de beloofde maatschappelijke over onze toekomstige energievoorziening van start is gegaan en nog voor de regering haar nota over de elektriciteitsvoorziening nog meer kolen of kernenergie heeft heeft vorige week de een belangrijke dit in het zakje gedaan de van grote elektriciteitscentrales kan zeker tien jaar worden en van de van centrales volgens de technologie kan zelfs helemaal worden afgezien als de mag en kan worden van elektriciteit voor het openbare net technisch kan de zo per jaar ongeveer de helft van het en daarmee bovendien een hoeveelheid brandstof besparen gelijk aan vier miljard meter aardgas of drie miljoen ton olie die ingevoerd een miljard zo kosten wel zoden er dan in de komende tien jaar investeringen tot vijf miljard nodig zijn maar die zoden ook de en manjaren werkgelegenheid per jaar opleveren terwijl de door de nog eens blijvende werkgelegenheid voor tot man geeft een boeiend perspectief dat vorige week werd geboden door technisch manager van raffinaderij in en van directer van de vereniging in op een bij de van de en in de de vereniging onderzocht door middel van een te bij de de mogelijkheden voor met daarbij ongetwijfeld in het achterhoofd dat de al meer elektriciteit opwekt dan de totale,p,NE,Y
414,111,1746,1746,/Users/leonardovida/dev/HistAware/data/raw/delpher/1980s/1984/12-06/DDD_011011194/DDD_011011194_0052_articletext.xml,DDD_011011194_0052_articletext.xml,2,1984-12-06,/Users/leonardovida/dev/HistAware/data/raw/delpher/1980s/1984/12-06/DDD_011011194,coal,7172661,23403.0,/Users/leonardovida/dev/HistAware/data/raw/delpher/1980s/1984/12-06/DDD_011011194/DDD:ddd:011011194:mpeg21.didl.xml.gz.xml,DDD:ddd:011011194:mpeg21.didl.xml.gz.xml,Groningen,1984-12-06,290.0,nl,Nieuwenhuis,Groninger archieven,Nieuwsblad van het Noorden,97.0,0.0411058308420338,"Het rijtje delfstoffen, dat John Wicks (topambtenaar en energiedeskundige van de federale regering in Canberra) opsomt, klinkt haast ongelofelijk. „Kolen: voor 300 jaar genoeg. Bruinkool: kunnen we duizend jaar mee toe. Olie: 2,5 miljard barrels (vaten van 159 liter - EgbZ). Aardgas: twee grote velden"". En de reeks kan moeiteloos worden . aangevuld.... uranium, teerzanden („nog niet op economische schaal winbaar""), ijzererts („voor 190 jaar""), bauxiet, nikkel, koper, lood en zink. De ambtelijk-droge opsomming van al die bodemvondsten, sommige van zeer recente datum, lijkt te moeten ondersteunen wat Ed Shann, economisch stafmedewerker van Shell Australië, al eerder in Melbourne had gezegd: Australië is een „Lucky Country"". De actuele vraag is echter of het land in economisch opzicht wel zo mazzelt met al die bodemschatten. Het kon zich daardoor weliswaar in korte tijd; opwerken tot een van de belangrijkste leveranciers van ruwe grondstoffen1 in dë wereld, maar met die. ;„nieuwe rijkdom"" heeft het land geen kans gezien zijn door hoge tariéfmüreh"" beschermde en veelal sterk verouderde industrie te vernieuwen;, Ed Shann hierover: j,Als exporteur van grondstoffen profiteert Australië uiteraard veel minder van zijn uitvoer dan de.landen, die fabrieksklare produkten (met een hoge toegevoegde waarde) aan te bieden hebben"". Tekenend cijfer in dit verband (eveneens verstrekt door Shann) is, dat de export maar vijftien procent van Australiës bruto nationaal produkt vertegenwoordigt. Ter vergelijking: Nederland drijft voor de helft op zijn export. . Geen uitvoer dus (althans geen beduidende) van fabrieksklare goederen. En de meeste ' industriële produkten j voor. eigen gebruik moeten worden ingevoerd. Met iets meer dan vijftien miljoen . inwoners is de thuismarkt in veel gevallen domweg te klein en te verspreid voor het succesvol, dat wil zeggen winstgevend, produceren van eigenfabrikaat. Geen wonder dus, dat zelfs op een eenvoudig drukwerk als een jaarboekje wordt vermeld dat het „met trots gedrukt is in Australië"". En het is in dit verband komisch en gênant tegelijk, op een personenauto van het Japanse merk Mitsubishi een sticker \te moeten ontdekken - met de boodschap „Buy Australian"", wat zoveel wil zeggen als: Koop Australische waar, dan helpen we elkaar. Natuurlijk, de auto. is zeker „gemaakt"", dat wil zeggen geassembleerd in de Zuid-Australische hoofdstad Adelaide, maar de onderdelen komen kant en klaar uit Japan, dat de laatste decennia in! vrijwel allé j opzichten de'/ bè-, langrijkste handelspartner van Australië is geworden; En tien tegen één is de carosserie vervaardigd van staal uit eerst naar Japan geëxporteerd Australisch ijzererts. :-ltpfci Zoiets prikt. Temeer omdat de statistiek genadeloos uitwijst, hoe het land intussen internationaal terrein aan het verliezen is: het aandeel in de wereldhandel zakte van 1,7 procent aan het begin van de jaren zeventig naar een en een kwart procent nu. ' Om het getij te keren zal Australië dus de bakens moeten verzetten en aan een op vernieuwing gericht '■' industriebeleid gestalte moeten zien te geven. Snel, want de tijd dringt, de achterstand is groot, zo hoor je nogal eens. De belangrijkste trefwoorden in het nieuw-economisch woordenboek van het bij werkgevers als „redelijk conservatief' te boek staande Labour-kabinet van ex-vakbondsleider Bob Hawke, zijn dan ook: chips, robots en biotechnologie. Aan de ontwikkeling van de biotechnologie wordt, gezien de rijke agrarische traditie van het land, de belangrijkste economische potentie toegekend.",het rijtje delfstoffen dat en van de federale regering in opsomt klinkt haast ongelofelijk kolen voor jaar genoeg we jaar mee toe olie miljard barrels vaten van liter aardgas twee grote velden en de reeks kan moeiteloos worden nog niet op economische schaal ijzererts voor jaar nikkel koper lood en zink de opsomming van al die sommige van zeer recente lijkt te moeten wat economisch stafmedewerker van al eerder in had gezegd is een de vraag is echter of het land in economisch opzicht wel zo mazzelt met al die bodemschatten het kon zich daardoor weliswaar in korte tijd opwerken tot een van de belangrijkste leveranciers van grondstoffen in wereld maar met die rijkdom heeft het land geen kans gezien zijn door hoge beschermde en veelal sterk te hierover als van grondstoffen profiteert veel minder van zijn dan die met een hoge toegevoegde waarde aan te bieden hebben tekenend cijfer in dit verband eveneens verstrekt door is dat de export maar vijftien procent van nationaal vertegenwoordigt ter vergelijking drijft voor de helft op zijn export geen althans geen van goederen en de meeste voor eigen moeten worden ingevoerd met iets meer dan vijftien miljoen inwoners is de in veel gevallen domweg te klein en te verspreid voor het dat wil zeggen winstgevend van geen wonder dat zelfs op een als een wordt vermeld dat het met trots is in en het is in dit verband komisch en tegelijk op een van het merk een sticker moeten ontdekken met de boodschap wat zoveel wil zeggen als koop waar dan helpen we elkaar de is zeker gemaakt dat wil zeggen geassembleerd in de hoofdstad maar de onderdelen komen kant en klaar dat de laatste decennia in vrijwel all opzichten handelspartner van is geworden en tien tegen is de vervaardigd van staal eerst naar ge ijzererts zoiets prikt temeer omdat de statistiek genadeloos hoe het land internationaal terrein aan het verliezen is het aandeel in de wereldhandel zakte van procent aan het begin van de jaren zeventig naar een en een kwart procent om het getij te keren zal de bakens moeten verzetten en aan een op gericht gestalte moeten zien te geven snel want de tijd dringt de achterstand is groot zo hoor je nogal eens de belangrijkste trefwoorden in het woordenboek van het bij werkgevers als redelijk conservatief te boek staande van bob zijn dan ook chips robots en biotechnologie aan de ontwikkeling van de biotechnologie wordt gezien de rijke agrarische traditie van het land de belangrijkste economische potentie toegekend,p,PO,Y
417,254,8260,8260,/Users/leonardovida/dev/HistAware/data/raw/delpher/1980s/1987/02-19/DDD_011207431/DDD_011207431_0193_articletext.xml,DDD_011207431_0193_articletext.xml,1,1987-02-19,/Users/leonardovida/dev/HistAware/data/raw/delpher/1980s/1987/02-19/DDD_011207431,coal,2978054,9661.0,/Users/leonardovida/dev/HistAware/data/raw/delpher/1980s/1987/02-19/DDD_011207431/DDD:ddd:011207431:mpeg21.didl.xml.gz.xml,DDD:ddd:011207431:mpeg21.didl.xml.gz.xml,Amsterdam,1987-02-19,30830.0,nl,Dagblad De Telegraaf,Koninklijke Bibliotheek C 98,De Telegraaf,95.0,0.0487159048430062,"Verschillende vaste brandstoffen, zoals kolen, hout, kunststoffen en zelfs allerlei afvalstoffen wórden in energie omgezet. De zogenaamde Vaste Brandstof Verbrandings Kamer (VBVK) zal (na nog eens vier tot vijf jaar verdere ontwikkeling) in de praktijk bruikbaar kunnen worden als generator en als voortstuwingsmotor. De buitenzijde van de VBVK blijft koel, ook als binnen een temperatuur van 3000 graden heerst. Koeling is dus niet nodig en warmteverliezen blijven beperkt. Volgens Delftse berekeningen zou verbranding van de 34 miljoen ton brandbaar afval die jaarlijks in Nederland vrijkomen, via VKBV's kunnen voorzien in 8% van de energiebehoefte. Bij gebruik als stuwmotor voor ruimtevaartuigen zou een grote gewichtsbesparing kunnen worden bereikt.",verschillende vaste brandstoffen zoals kolen hot en zelfs allerlei afvalstoffen in energie omgezet de zogenaamde vaste brandstof kamer zal na nog eens vier tot vijf jaar verdere ontwikkeling in de praktijk worden als generator en als de van de blijft koel ook als binnen een van graden heerst koeling is niet nodig en warmteverliezen blijven beperkt volgens berekeningen zo verbranding van de miljoen ton brandbaar afval die jaarlijks in vrijkomen via voorzien in van de bij als voor zo een grote worden bereikt,p,PO,Y
418,256,8302,8302,/Users/leonardovida/dev/HistAware/data/raw/delpher/1980s/1980/10-15/DDD_010570282/DDD_010570282_0108_articletext.xml,DDD_010570282_0108_articletext.xml,1,1980-10-15,/Users/leonardovida/dev/HistAware/data/raw/delpher/1980s/1980/10-15/DDD_010570282,coal,3536431,11500.0,/Users/leonardovida/dev/HistAware/data/raw/delpher/1980s/1980/10-15/DDD_010570282/DDD:ddd:010570282:mpeg21.didl.xml.gz.xml,DDD:ddd:010570282:mpeg21.didl.xml.gz.xml,Heerlen,1980-10-15,243.0,nl,Nieuwe Limburger koerier;Uitgeversmaatschappĳ Limburgs Dagblad,KB C 101,Limburgsch dagblad,62.0,0.0374208986537901,"DEN HAAG - Als er geen kerncentrales worden gebouwd, zal het Nederlandse kolenverbruik kunnen oplopen tot 43 miljoen ton per jaar aan het einde van deze eeuw. Het olieverbruik zal dan 44 miljoen ton bedragen en er zal jaarlijks 51 miljard kubiekemeter aardgas moeten worden verbruikt. In 1978 omvatte het energieverbruik in ons land 5,5 miljoen ton kolen, 23 miljoen ton olie en 46 miljard kubieke meter aardgas.",als er geen worden zal het oplopen tot miljoen ton per jaar aan het einde van deze het zal dan miljoen ton bedragen en er zal jaarlijks miljard aardgas moeten worden in omvatte het in ons land miljoen ton kolen miljoen ton olie en miljard meter aardgas,p,PO,Y
419,71,1063,1063,/Users/leonardovida/dev/HistAware/data/raw/delpher/1980s/1982/07-17/DDD_010961125/DDD_010961125_0305_articletext.xml,DDD_010961125_0305_articletext.xml,3,1982-07-17,/Users/leonardovida/dev/HistAware/data/raw/delpher/1980s/1982/07-17/DDD_010961125,coal,6183914,20034.0,/Users/leonardovida/dev/HistAware/data/raw/delpher/1980s/1982/07-17/DDD_010961125/DDD:ddd:010961125:mpeg21.didl.xml.gz.xml,DDD:ddd:010961125:mpeg21.didl.xml.gz.xml,Rotterdam,1982-07-17,10763.0,nl,De Arbeiderspers,Gemeentearchief Rotterdam,Het vrĳe volk : democratisch-socialistisch dagblad,38.0,0.0385098180173967,"Als op dit ogenblik de centrale kolen stookte, in plaats van olie, zou het per dag 1 miljoen gulden schelen, schat Traast. Per jaar verstookt de elektriciteitsfabriek Maasvlakte 1 miljoen ton olie. Dat wordt daar- ™', \ straks 2 miljoen ton kolen. Laatste berekeningen van BP wijzen nog steeds in de richting van het verhoudingsgewijs goedkoper worden van de kolen. „En daarbij speelt mee dat we op een uniek punt zitten,"" zegt ir. Traast. „Naast de kolenoverslag van EMO en daarstraks Multi Coal Terminal. We maken een transportband van die terreinen naar ons terrein en daarmee is het vervoersprobleem opgelost. Heel anders dan Dordt dat elke ton per schip over de rivier moet krijgen aangevoerd.'\;;,v",als op dit ogenblik de centrale kolen stookte in plaats van olie zo het per dag miljoen schelen schat per jaar verstookt de elektriciteitsfabriek miljoen ton olie dat wordt straks miljoen ton kolen laatste berekeningen van wijzen nog steeds in de richting van het goedkoper worden van de kolen en daarbij speelt mee dat we op een zitten zegt naast de van en daarstraks terminal we maken een transportband van die terreinen naar ons terrein en daarmee is het opgelost heel anders dan dat elke ton per schip over de rivier moet krijgen aangevoerd,p,PO,Y
424,118,1853,1853,/Users/leonardovida/dev/HistAware/data/raw/delpher/1980s/1985/03-01/DDD_010569902/DDD_010569902_0013_articletext.xml,DDD_010569902_0013_articletext.xml,2,1985-03-01,/Users/leonardovida/dev/HistAware/data/raw/delpher/1980s/1985/03-01/DDD_010569902,coal,4756917,15192.0,/Users/leonardovida/dev/HistAware/data/raw/delpher/1980s/1985/03-01/DDD_010569902/DDD:ddd:010569902:mpeg21.didl.xml.gz.xml,DDD:ddd:010569902:mpeg21.didl.xml.gz.xml,Amersfoort,1985-03-01,9880.0,nl,Stichting Nederlands Dagblad,Nederlands Dagblad,Nederlands dagblad : gereformeerd gezinsblad / hoofdred. P. Jongeling ... [et al.],41.0,0.0466038276090538,"Tegen de stelling van de Europese Commissie dat de aardgasprijs voor Nederlandse tuinders concurrentievervalsend is, kan ook nog worden aangevoerd, dat er internationaal geen afzonderlijke standaardprijs voor aardgas bestaat. Die prijs is gekoppeld aan die van de eerst voor de hand liggende vervanging, in dit geval stookolie. Vergeleken daarbij stoken onze tuinders inderdaad goedkoop. Maar zonder aardgas zouden zij niet op dure stookolie overschakelen, maar eerder op steenkool. Men kan dus evengoed de stelling verdedigen, dat de prijs voor aardgas met die van steenkool vergeleken moet worden.",tegen de stelling van de commissie dat de voor is kan ook nog worden aangevoerd dat er internationaal geen afzonderlijke standaardprijs voor aardgas bestaat die prijs is gekoppeld aan die van de eerst voor de hand liggende vervanging in dit geval stookolie vergeleken daarbij stoken onze inderdaad goedkoop maar zonder aardgas zoden zij niet op stookolie overschakelen maar eerder op steenkool men kan evengoed de stelling verdedigen dat de prijs voor aardgas met die van steenkool vergeleken moet worden,p,NE,Y
